index,TMDBid,desc,img,imgSmall,title,title,trailer,allGenres,duration
0,476968,"Risking his life, Luke ventures to Rome to visit Paul -- the apostle who's bound in chains and held captive in Nero's darkest and bleakest prison cell. Haunted by the shadows of his past misdeeds, Paul wonders if he's been forgotten as he awaits his grisly execution. Before Paul's death, Luke resolves to write another book that details the birth of what will come to be known as the church.",/euAMcJLG26pW1kv4kPEtVEwwroQ.jpg,/2NUXG94dGMKYgJL1BkJGKynMb3l.jpg,"Paul, Apostle of Christ","Paul, Apostle of Christ",False,,108
1,378108,"Japan, 1943, during World War II. Young Suzu leaves her village near Hiroshima to marry and live with her in-laws in Kure, a military harbor. Her creativity to overcome deprivation quickly makes her indispensable at home. Inhabited by an ancestral wisdom, Suzu impregnates the simple gestures of everyday life with poetry and beauty. The many hardships, the loss of loved ones, the frequent air raids of the enemy, nothing alters her enthusiasm…",/mNOB5JoW1imvdGrZ52RGZgJCop0.jpg,/9Z4H4M2F8OQTB04YC1Opds8MFBb.jpg,この世界の片隅に,In This Corner of the World,False,,130
2,652,"In year 1250 B.C. during the late Bronze age, two emerging nations begin to clash. Paris, the Trojan prince, convinces Helen, Queen of Sparta, to leave her husband Menelaus, and sail with him back to Troy. After Menelaus finds out that his wife was taken by the Trojans, he asks his brother Agamemnom to help him get her back. Agamemnon sees this as an opportunity for power. So they set off with 1,000 ships holding 50,000 Greeks to Troy. With the help of Achilles, the Greeks are able to fight the never before defeated Trojans.",/qZitv5zrSXfJafGThxmvbvTsuu5.jpg,/a07wLy4ONfpsjnBqMwhlWTJTcm.jpg,Troy,Troy,False,,163
3,502581,"Authorized biopic of Brazilian evangelical bishop Edir Macedo, founder of the Universal Church of the Kingdom of God and owner of Record TV network. Based on a book trilogy of the same name, the movie tells the story of the self-made man who faced several moments of turbulence while pursuing his conviction.",/x53rt95zFbCjfFidDsH6kukMiWz.jpg,/1Qk9eD3ZqmJ7V8bB28H7gUd1FPg.jpg,Nada a Perder,Nothing to Lose,False,,130
4,7214,"Based on a true story, in which Richmond High School head basketball coach Ken Carter made headlines in 1999 for benching his undefeated team due to poor academic results.",/n4CvA50GBtIPrSqCl8nMNZCliYI.jpg,/y3HOTTyM5nLsdUzXFtFCohG28qj.jpg,Coach Carter,Coach Carter,False,,136
5,407439,"In the first century, free-spirited Mary Magdalene flees the marriage her family has arranged for her, finding refuge and a sense of purpose in a radical new movement led by the charismatic, rabble-rousing preacher named Jesus.",/hvdRLJSKy2a3Ulzrl1Wlnqq2pKZ.jpg,/7IBGsaUXMol2K8I1BTBgxEBuS6y.jpg,Mary Magdalene,Mary Magdalene,False,,120
6,857,"As U.S. troops storm the beaches of Normandy, three brothers lie dead on the battlefield, with a fourth trapped behind enemy lines. Ranger captain John Miller and seven men are tasked with penetrating German-held territory and bringing the boy home.",/3E5pvJLNEz5WmYWl6GfFW8hEVV3.jpg,/1wY4psJ5NVEhCuOYROwLH2XExM2.jpg,Saving Private Ryan,Saving Private Ryan,False,,169
7,277216,"In 1987, five young men, using brutally honest rhymes and hardcore beats, put their frustration and anger about life in the most dangerous place in America into the most powerful weapon they had: their music.  Taking us back to where it all began, Straight Outta Compton tells the true story of how these cultural rebels—armed only with their lyrics, swagger, bravado and raw talent—stood up to the authorities that meant to keep them down and formed the world’s most dangerous group, N.W.A.  And as they spoke the truth that no one had before and exposed life in the hood, their voice ignited a social revolution that is still reverberating today.",/wKmG0Fuasb9HUD3jgwQamGb5sAq.jpg,/1CiLJx8Xtv3TbbFj6k7BboSmKgC.jpg,Straight Outta Compton,Straight Outta Compton,False,,147
8,14574,"When his family moves from their home in Berlin to a strange new house in Poland, young Bruno befriends Shmuel, a boy who lives on the other side of the fence where everyone seems to be wearing striped pajamas. Unaware of Shmuel's fate as a Jewish prisoner or the role his own Nazi father plays in his imprisonment, Bruno embarks on a dangerous journey inside the camp's walls.",/fcDdXbrg2N4j9t9DOptpxcWuIXL.jpg,/2C8QCXdMlojTxZjfBlINr4FWcb6.jpg,The Boy in the Striped Pyjamas,The Boy in the Striped Pyjamas,False,,94
9,6844,"Escaping death, a Hebrew infant is raised in a royal household to become a prince. Upon discovery of his true heritage, Moses embarks on a personal quest to reclaim his destiny as the leader and liberator of the Hebrew people.",/rKiNFQYpe0qPbVKkBWbUJAVtNl.jpg,/3Ei59AR64x6dMZfWobPCkZjbqTL.jpg,The Ten Commandments,The Ten Commandments,False,,220
10,300168,"Huo An, the commander of the Protection Squad of the Western Regions, was framed by evil forces and becomes enslaved. On the other hand, a Roman general escapes to China after rescuing the Prince. The heroic duo meet in the Western Desert and a thrilling story unfolds.",/rnNkUJlo03a8D0utxiOrADstaMT.jpg,/suTAWYLIHAnkH2V4nC8t3AG7HjR.jpg,天將雄師,Dragon Blade,False,,127
11,359724,"American car designer Carroll Shelby and the British-born driver Ken Miles work together to battle corporate interference, the laws of physics, and their own personal demons to build a revolutionary race car for Ford Motor Company and take on the dominating race cars of Enzo Ferrari at the 24 Hours of Le Mans in France in 1966.",/ydmZIafp66mHABs3QJDwvjRgZfE.jpg,/dR1Ju50iudrOh3YgfwkAU1g2HZe.jpg,Ford v Ferrari,Ford v Ferrari,False,,153
12,300671,An American Ambassador is killed during an attack at a U.S. compound in Libya as a security team struggles to make sense out of the chaos.,/ayDMYGUNVvXS76wQgFwTiUIDNb5.jpg,/4qnEeVPM8Yn5dIVC4k4yyjrUXeR.jpg,13 Hours: The Secret Soldiers of Benghazi,13 Hours: The Secret Soldiers of Benghazi,False,,144
13,424694,"Singer Freddie Mercury, guitarist Brian May, drummer Roger Taylor and bass guitarist John Deacon take the music world by storm when they form the rock 'n' roll band Queen in 1970. Hit songs become instant classics. When Mercury's increasingly wild lifestyle starts to spiral out of control, Queen soon faces its greatest challenge yet – finding a way to keep the band together amid the success and excess.",/93xA62uLd5CwMOAs37eQ7vPc1iV.jpg,/lHu1wtNaczFPGFDTrjCSzeLPTKN.jpg,Bohemian Rhapsody,Bohemian Rhapsody,False,,135
14,1579,"Set in the Mayan civilization, when a man's idyllic presence is brutally disrupted by a violent invading force, he is taken on a perilous journey to a world ruled by fear and oppression where a harrowing end awaits him. Through a twist of fate and spurred by the power of his love for his woman and his family he will make a desperate break to return home and to ultimately save his way of life.",/s8yphXScZsnvTFbSFE8rIG334vK.jpg,/cBFQsU1LDBEOl0Ik0cygeB6wCLE.jpg,Apocalypto,Apocalypto,False,,139
15,20662,"When soldier Robin happens upon the dying Robert of Loxley, he promises to return the man's sword to his family in Nottingham. There, he assumes Robert's identity; romances his widow, Marion; and draws the ire of the town's sheriff and King John's henchman, Godfrey.",/h7AKqgIh86HDgJIzENeR2ng1Knn.jpg,/9NS5QGOfck24yL3bZqWeW06PgPC.jpg,Robin Hood,Robin Hood,False,,140
16,54989,"Man remembers 48 crucial hours in his life when, as a child, he visited his mother, the favorite woman of an important politician, in a bordello owned by him, right before some important political changes in 1937 Brazil. In those hours, he discovers his own sexuality.",/y2TwGM0sR6SwVa1RaehLB5TxZr0.jpg,/qXwsEYqB2nFIEaCwhYkPbfv9nZ9.jpg,"Amor, Estranho Amor","Love, Strange Love",False,,123
17,28005,"Tara and Maya are two inseparable friends in India. Their tastes, habits, and hobbies are the same. Years later, the two have matured, but have maintained their friendship. Tara gets married to the local prince, Raj Singh, who soon succeeds the throne as the sole heir. After the marriage, Raj gets bored of Tara and starts seeking another female to satisfy his sexual needs. He notices Maya and is instantly attracted to her. He has her included as one of his courtesans, and is intimate with her. Watch what happens when Tara finds out and the extent she will go to keep her marriage intact.",/gftDU03xnFig2yrNYrNFPCBMQZC.jpg,/dwbLcEPIjVISly6DW8GLX8vsZlE.jpg,Kama Sutra: A Tale of Love,Kama Sutra: A Tale of Love,False,,117
18,324786,"WWII American Army Medic Desmond T. Doss, who served during the Battle of Okinawa, refuses to kill people and becomes the first Conscientious Objector in American history to receive the Congressional Medal of Honor.",/rshlQ6LfPRSWFhpGL4s5ZkIPR51.jpg,/fTuxNlgEm04PPFkr1xfK94Jn8BW.jpg,Hacksaw Ridge,Hacksaw Ridge,False,,139
19,381284,"The untold story of Katherine G. Johnson, Dorothy Vaughan and Mary Jackson – brilliant African-American women working at NASA and serving as the brains behind one of the greatest operations in history – the launch of astronaut John Glenn into orbit. The visionary trio crossed all gender and race lines to inspire generations to dream big.",/rfkIeCaIHhN3K5wjJJqKmfUjYp8.jpg,/9lfz2W2uGjyow3am00rsPJ8iOyq.jpg,Hidden Figures,Hidden Figures,False,,127
20,371370,"This movie is very different from the previous TV specials (Dragon Ball Z: Bardock - The Father of Goku and Dragon Ball Z: The History of Trunks), as it is a look back at what had happened in Dragon Ball Z in 1993.  In this film, which is believed to take place some time around the 25th World Martial Arts Tournament, Gohan and Goten are having a hot bath outside in the middle of winter. Goku (who is still dead) suddenly appears in front of his sons with the help of his Instant Transmission, and joins them in the tub. While there, the three Saiyans reflect back on the events that occurred during the Cell Games. Inside the house after Chi-Chi appeared, Goku tells his sons about Pikkon and the Other World Tournament.  Later, the four members of the Son family appear dressed nicely. Gohan says that the adult division of the Tournament will begin this next year (in 1994), and the special comes to an end.",,/sOtvIOc65gmDdrAk3Eg01oH4gZY.jpg,Dragon Ball Z: Zenbu Misemasu Toshi Wasure Dragon Ball Z!,Looking Back at it All: The Dragon Ball Z Year-End Show!,False,,5
21,57214,"Three high school seniors throw a party to make a name for themselves. As the night progresses, things spiral out of control as word of the party spreads.",/5vAv4h4vugleYsbsNkUb9kcrk8h.jpg,/lUPDGT3lyRrq8SvWuNWG2DP64bR.jpg,Project X,Project X,False,,88
22,809,"Shrek, Fiona and Donkey set off to Far, Far Away to meet Fiona's mother and father. But not everyone is happy. Shrek and the King find it hard to get along, and there's tension in the marriage. The fairy godmother discovers that Shrek has married Fiona instead of her Son Prince Charming and sets about destroying their marriage.",/g1EsYgp8GbdztpodCCa2n7xxc5S.jpg,/2yYP0PQjG8zVqturh1BAqu2Tixl.jpg,Shrek 2,Shrek 2,False,,93
23,384018,"Ever since US Diplomatic Security Service Agent Hobbs and lawless outcast Shaw first faced off, they just have traded smack talk and body blows. But when cyber-genetically enhanced anarchist Brixton's ruthless actions threaten the future of humanity, they join forces to defeat him.",/hpgda6P9GutvdkDX5MUJ92QG9aj.jpg,/qRyy2UmjC5ur9bDi3kpNNRCc5nc.jpg,Fast & Furious Presents: Hobbs & Shaw,Fast & Furious Presents: Hobbs & Shaw,False,,137
24,425,"With the impending ice age almost upon them, a mismatched trio of prehistoric critters – Manny the woolly mammoth, Diego the saber-toothed tiger and Sid the giant sloth – find an orphaned infant and decide to return it to its human parents. Along the way, the unlikely allies become friends but, when enemies attack, their quest takes on far nobler aims.",/mCVQ2cZmGkAHG2Q3fDZTQA1YzeI.jpg,/gLhHHZUzeseRXShoDyC4VqLgsNv.jpg,Ice Age,Ice Age,False,,81
25,177572,"A special bond develops between plus-sized inflatable robot Baymax, and prodigy Hiro Hamada, who team up with a group of friends to form a band of high-tech heroes.",/wURLf7FW0WYytXl9aeYu5dTbmAT.jpg,/2mxS4wUimwlLmI1xp6QW6NSU361.jpg,Big Hero 6,Big Hero 6,False,,102
26,2062,"Remy, a resident of Paris, appreciates good food and has quite a sophisticated palate. He would love to become a chef so he can create and enjoy culinary masterpieces to his heart's delight. The only problem is, Remy is a rat. When he winds up in the sewer beneath one of Paris' finest restaurants, the rodent gourmet finds himself ideally placed to realize his dream.",/xgDj56UWyeWQcxQ44f5A3RTWuSs.jpg,/npHNjldbeTHdKKw28bJKs7lzqzj.jpg,Ratatouille,Ratatouille,False,,111
27,532067,"It is not strange that the Demon Lord's forces fear the Crimson Demons, the clan from which Megumin and Yunyun originate. Even if the Demon Lord's generals attack their village, the Crimson Demons can just easily brush them off with their supreme mastery of advanced and overpowered magic.  When Yunyun receives a seemingly serious letter regarding a potential disaster coming to her hometown, she immediately informs Kazuma Satou and the rest of his party. After a series of wacky misunderstandings, it turns out to be a mere prank by her fellow demon who wants to be an author. Even so, Megumin becomes worried about her family and sets out toward the Crimson Demons' village with the gang.  There, Kazuma and the others decide to sightsee the wonders of Megumin's birthplace. However, they soon come to realize that the nonsense threat they received might have been more than just a joke.",/m5HPKCi7GdhKmxPTcOQmcLfEmZ9.jpg,/j73LuQcA21KvkVFcroWWMN8tTJv.jpg,映画 この素晴らしい世界に祝福を！紅伝説,KonoSuba: God's Blessing on this Wonderful World! Legend of Crimson,False,,90
28,301528,"Woody has always been confident about his place in the world and that his priority is taking care of his kid, whether that's Andy or Bonnie. But when Bonnie adds a reluctant new toy called ""Forky"" to her room, a road trip adventure alongside old and new friends will show Woody how big the world can be for a toy.",/q62bpQ67qaXY0u6b2wFEnQYIbPd.jpg,/w9kR8qbmQ01HwnvK4alvnQ2ca0L.jpg,Toy Story 4,Toy Story 4,False,,100
29,214756,"Newlywed couple Ted and Tami-Lynn want to have a baby, but in order to qualify to be a parent, Ted will have to prove he's a person in a court of law.",/jKXzYoVQShnYE25qxS3fgFggx4r.jpg,/qMOt0uy1x49OBW0jzodgRM9waW0.jpg,Ted 2,Ted 2,False,,115
30,863,"Andy heads off to Cowboy Camp, leaving his toys to their own devices. Things shift into high gear when an obsessive toy collector named Al McWhiggen, owner of Al's Toy Barn kidnaps Woody. Andy's toys mount a daring rescue mission, Buzz Lightyear meets his match and Woody has to decide where he and his heart truly belong.",/91qfG6VaxRsCh1SbIi1w2vxknsL.jpg,/eVGu0zsezaSCuN67zgNhzjeNI9Z.jpg,Toy Story 2,Toy Story 2,False,,92
31,808,"It ain't easy bein' green -- especially if you're a likable (albeit smelly) ogre named Shrek. On a mission to retrieve a gorgeous princess from the clutches of a fire-breathing dragon, Shrek teams up with an unlikely compatriot -- a wisecracking donkey.",/2at55O0N9cXwr5fW9bfM8WG5pAi.jpg,/dyhaB19AICF7TO7CK2aD6KfymnQ.jpg,Shrek,Shrek,False,,90
32,585,"James Sullivan and Mike Wazowski are monsters, they earn their living scaring children and are the best in the business... even though they're more afraid of the children than they are of them. When a child accidentally enters their world, James and Mike suddenly find that kids are not to be afraid of and they uncover a conspiracy that could threaten all children across the world.",/c7VbRPlev1bRfKvTxr98erw5T7B.jpg,/sgheSKxZkttIe8ONsf2sWXPgip3.jpg,"Monsters, Inc.","Monsters, Inc.",False,,92
33,106646,"A New York stockbroker refuses to cooperate in a large securities fraud case involving corruption on Wall Street, corporate banking world and mob infiltration. Based on Jordan Belfort's autobiography.",/blbA7NEHARQOWy5i9VF5K2kHrPc.jpg,/pWHf4khOloNVfCxscsXFj3jj6gP.jpg,The Wolf of Wall Street,The Wolf of Wall Street,False,,180
34,293660,"The origin story of former Special Forces operative turned mercenary Wade Wilson, who, after being subjected to a rogue experiment that leaves him with accelerated healing powers, adopts the alter ego Deadpool. Armed with his new abilities and a dark, twisted sense of humor, Deadpool hunts down the man who nearly destroyed his life.",/en971MEXui9diirXlogOrPKmsEn.jpg,/fSRb7vyIP8rQpL0I47P3qUsEKX3.jpg,Deadpool,Deadpool,False,,108
35,347201,"The spirited Boruto Uzumaki, son of Seventh Hokage Naruto, is a skilled ninja who possesses the same brashness and passion his father once had. However, the constant absence of his father, who is busy with his Hokage duties, puts a damper on Boruto's fire. He ends up meeting his father's friend Sasuke, and requests to become... his apprentice!? The curtain on the story of the new generation rises!",/fy8bBNQyKtRnznm3G3QWdu2wIC8.jpg,/1k6iwC4KaPvTBt1JuaqXy3noZRY.jpg,BORUTO -NARUTO THE MOVIE-,Boruto: Naruto the Movie,False,,95
36,118,"A young boy wins a tour through the most magnificent chocolate factory in the world, led by the world's most unusual candy maker.",/bSvUW4JQ6g4QiKvwejcfcPRd4Ke.jpg,/wfGfxtBkhBzQfOZw4S8IQZgrH0a.jpg,Charlie and the Chocolate Factory,Charlie and the Chocolate Factory,False,,115
37,862,"Led by Woody, Andy's toys live happily in his room until Andy's birthday brings Buzz Lightyear onto the scene. Afraid of losing his place in Andy's heart, Woody plots against Buzz. But when circumstances separate Buzz and Woody from their owner, the duo eventually learns to put aside their differences.",/3Rfvhy1Nl6sSGJwyjb0QiZzZYlB.jpg,/uXDfjJbdP4ijW5hWSBrPrlKpxab.jpg,Toy Story,Toy Story,False,,81
38,354912,"Despite his family’s baffling generations-old ban on music, Miguel dreams of becoming an accomplished musician like his idol, Ernesto de la Cruz. Desperate to prove his talent, Miguel finds himself in the stunning and colorful Land of the Dead following a mysterious chain of events. Along the way, he meets charming trickster Hector, and together, they set off on an extraordinary journey to unlock the real story behind Miguel's family history.",/askg3SMvhqEl4OL52YuvdtY40Yb.jpg,/gGEsBPAijhVUFoiNpgZXqRVWJt2.jpg,Coco,Coco,False,,105
39,371370,"This movie is very different from the previous TV specials (Dragon Ball Z: Bardock - The Father of Goku and Dragon Ball Z: The History of Trunks), as it is a look back at what had happened in Dragon Ball Z in 1993.  In this film, which is believed to take place some time around the 25th World Martial Arts Tournament, Gohan and Goten are having a hot bath outside in the middle of winter. Goku (who is still dead) suddenly appears in front of his sons with the help of his Instant Transmission, and joins them in the tub. While there, the three Saiyans reflect back on the events that occurred during the Cell Games. Inside the house after Chi-Chi appeared, Goku tells his sons about Pikkon and the Other World Tournament.  Later, the four members of the Son family appear dressed nicely. Gohan says that the adult division of the Tournament will begin this next year (in 1994), and the special comes to an end.",,/sOtvIOc65gmDdrAk3Eg01oH4gZY.jpg,Dragon Ball Z: Zenbu Misemasu Toshi Wasure Dragon Ball Z!,Looking Back at it All: The Dragon Ball Z Year-End Show!,False,,5
40,39254,"Charlie Kenton is a washed-up fighter who retired from the ring when robots took over the sport. After his robot is trashed, he reluctantly teams up with his estranged son to rebuild and train an unlikely contender.",/4f0Kj0QwPui5ydu1UavsnvP1m1o.jpg,/4GIeI5K5YdDUkR3mNQBoScpSFEf.jpg,Real Steel,Real Steel,False,,127
41,8966,"When Bella Swan moves to a small town in the Pacific Northwest, she falls in love with Edward Cullen, a mysterious classmate who reveals himself to be a 108-year-old vampire. Despite Edward's repeated cautions, Bella can't stay away from him, a fatal move that endangers her own life.",/weAYfu6FfrNxEDJ3xH1XpgQcqUv.jpg,/3Gkb6jm6962ADUPaCBqzz9CTbn9.jpg,Twilight,Twilight,False,,122
42,216015,"When college senior Anastasia Steele steps in for her sick roommate to interview prominent businessman Christian Grey for their campus paper, little does she realize the path her life will take. Christian, as enigmatic as he is rich and powerful, finds himself strangely drawn to Ana, and she to him. Though sexually inexperienced, Ana plunges headlong into an affair -- and learns that Christian's true sexual proclivities push the boundaries of pain and pleasure.",/nxnRRlj19nhMzratcB2eSknKZNp.jpg,/63kGofUkt1Mx0SIL4XI4Z5AoSgt.jpg,Fifty Shades of Grey,Fifty Shades of Grey,False,,125
43,61979,"Story of two young people who belong to different worlds. It is the chronicle of a love improbable, almost impossible but inevitable dragging in a frantic journey they discover the first great love. Babi is a girl from upper-middle class that is educated in goodness and innocence . Hache is a rebellious boy, impulsive, unconscious, has a appetite for risk and danger embodied in endless fights and illegal motorbike races, the limit of common sense",/2Mq10FWFbxoYgsZysWlw7T9wSNe.jpg,/fcFz2xEZodKOxHDn9DazxPYHDSc.jpg,Tres metros sobre el cielo,Three Steps Above Heaven,False,,122
44,597,"101-year-old Rose DeWitt Bukater tells the story of her life aboard the Titanic, 84 years later. A young Rose boards the ship with her mother and fiancé. Meanwhile, Jack Dawson and Fabrizio De Rossi win third-class tickets aboard the ship. Rose tells the whole story from Titanic's departure through to its death—on its first and last voyage—on April 15, 1912.",/yDI6D5ZQh67YU4r2ms8qcSbAviZ.jpg,/9xjZS2rlVxm8SFx8kPC3aIGCOYQ.jpg,Titanic,Titanic,False,,194
45,228150,"In the last months of World War II, as the Allies make their final push in the European theatre, a battle-hardened U.S. Army sergeant named 'Wardaddy' commands a Sherman tank called 'Fury' and its five-man crew on a deadly mission behind enemy lines. Outnumbered and outgunned, Wardaddy and his men face overwhelming odds in their heroic attempts to strike at the heart of Nazi Germany.",/kdbLf3aTQsEXqYlH9vA4fzmnSFz.jpg,/pfte7wdMobMF4CVHuOxyu6oqeeA.jpg,Fury,Fury,False,,135
46,348893,"In the fourth installment of the fighting franchise, Boyka is shooting for the big leagues when an accidental death in the ring makes him question everything he stands for. When he finds out the wife of the man he accidentally killed is in trouble, Boyka offers to fight in a series of impossible battles to free her from a life of servitude.",/gqN5Z1yMhZQ9qW4YnYpeL8epwlM.jpg,/7QGdIJWWTkPhVjpQ0zA6z69khod.jpg,Boyka: Undisputed IV,Boyka: Undisputed IV,False,,87
47,296096,"A small town girl is caught between dead-end jobs. A high-profile, successful man becomes wheelchair bound following an accident. The man decides his life is not worth living until the girl is hired for six months to be his new caretaker. Worlds apart and trapped together by circumstance, the two get off to a rocky start. But the girl becomes determined to prove to the man that life is worth living and as they embark on a series of adventures together, each finds their world changing in ways neither of them could begin to imagine.",/7jjwdoIVPJp7gcDo9uE1sVZi2Rs.jpg,/oo2Q3T8juOYFh2G1YJ3oSMAfUyq.jpg,Me Before You,Me Before You,False,,110
48,182026,"Oona, a recent graduate in anthropology, has returned to her dead mother’s seaside cottage in southern England to prepare it for sale. Her arrival disturbs Mani, a wary vagrant who has been squatting on the property.",,/4TKdguyacjYrC1Hnbi3PjSP8r3M.jpg,Stranger Things,Stranger Things,False,,77
49,315635,"Following the events of Captain America: Civil War, Peter Parker, with the help of his mentor Tony Stark, tries to balance his life as an ordinary high school student in Queens, New York City, with fighting crime as his superhero alter ego Spider-Man as a new threat, the Vulture, emerges.",/tTlAA0REGPXSZPBfWyTW9ipIv1I.jpg,/c24sv2weTHPsmDa7jEMN0m2P3RT.jpg,Spider-Man: Homecoming,Spider-Man: Homecoming,False,,133
50,372058,"High schoolers Mitsuha and Taki are complete strangers living separate lives. But one night, they suddenly switch places. Mitsuha wakes up in Taki’s body, and he in hers. This bizarre occurrence continues to happen randomly, and the two must adjust their lives around each other.",/mMtUybQ6hL24FXo0F3Z4j2KG7kZ.jpg,/q719jXXEzOoYaps6babgKnONONX.jpg,君の名は。,Your Name.,False,,106
51,24021,"Bella once again finds herself surrounded by danger as Seattle is ravaged by a string of mysterious killings and a malicious vampire continues her quest for revenge. In the midst of it all, she is forced to choose between her love for Edward and her friendship with Jacob, knowing that her decision has the potential to ignite the ageless struggle between vampire and werewolf. With her graduation quickly approaching, Bella is confronted with the most important decision of her life.",/r4OqScx7hVXsG1obaJjJKJNaxHT.jpg,/3mFM80dPzSqoXXuC2UMvLIRWX32.jpg,The Twilight Saga: Eclipse,The Twilight Saga: Eclipse,False,,124
