index,TMDBid,desc,img,imgSmall,title,title,trailer,allGenres,duration
425,228150,"In the last months of World War II, as the Allies make their final push in the European theatre, a battle-hardened U.S. Army sergeant named 'Wardaddy' commands a Sherman tank called 'Fury' and its five-man crew on a deadly mission behind enemy lines. Outnumbered and outgunned, Wardaddy and his men face overwhelming odds in their heroic attempts to strike at the heart of Nazi Germany.",/kdbLf3aTQsEXqYlH9vA4fzmnSFz.jpg,/pfte7wdMobMF4CVHuOxyu6oqeeA.jpg,Fury,Fury,False,,135
426,348893,"In the fourth installment of the fighting franchise, Boyka is shooting for the big leagues when an accidental death in the ring makes him question everything he stands for. When he finds out the wife of the man he accidentally killed is in trouble, Boyka offers to fight in a series of impossible battles to free her from a life of servitude.",/gqN5Z1yMhZQ9qW4YnYpeL8epwlM.jpg,/7QGdIJWWTkPhVjpQ0zA6z69khod.jpg,Boyka: Undisputed IV,Boyka: Undisputed IV,False,,87
427,296096,"A small town girl is caught between dead-end jobs. A high-profile, successful man becomes wheelchair bound following an accident. The man decides his life is not worth living until the girl is hired for six months to be his new caretaker. Worlds apart and trapped together by circumstance, the two get off to a rocky start. But the girl becomes determined to prove to the man that life is worth living and as they embark on a series of adventures together, each finds their world changing in ways neither of them could begin to imagine.",/7jjwdoIVPJp7gcDo9uE1sVZi2Rs.jpg,/oo2Q3T8juOYFh2G1YJ3oSMAfUyq.jpg,Me Before You,Me Before You,False,,110
428,182026,"Oona, a recent graduate in anthropology, has returned to her dead mother’s seaside cottage in southern England to prepare it for sale. Her arrival disturbs Mani, a wary vagrant who has been squatting on the property.",,/4TKdguyacjYrC1Hnbi3PjSP8r3M.jpg,Stranger Things,Stranger Things,False,,77
429,315635,"Following the events of Captain America: Civil War, Peter Parker, with the help of his mentor Tony Stark, tries to balance his life as an ordinary high school student in Queens, New York City, with fighting crime as his superhero alter ego Spider-Man as a new threat, the Vulture, emerges.",/tTlAA0REGPXSZPBfWyTW9ipIv1I.jpg,/c24sv2weTHPsmDa7jEMN0m2P3RT.jpg,Spider-Man: Homecoming,Spider-Man: Homecoming,False,,133
430,372058,"High schoolers Mitsuha and Taki are complete strangers living separate lives. But one night, they suddenly switch places. Mitsuha wakes up in Taki’s body, and he in hers. This bizarre occurrence continues to happen randomly, and the two must adjust their lives around each other.",/mMtUybQ6hL24FXo0F3Z4j2KG7kZ.jpg,/q719jXXEzOoYaps6babgKnONONX.jpg,君の名は。,Your Name.,False,,106
431,24021,"Bella once again finds herself surrounded by danger as Seattle is ravaged by a string of mysterious killings and a malicious vampire continues her quest for revenge. In the midst of it all, she is forced to choose between her love for Edward and her friendship with Jacob, knowing that her decision has the potential to ignite the ageless struggle between vampire and werewolf. With her graduation quickly approaching, Bella is confronted with the most important decision of her life.",/r4OqScx7hVXsG1obaJjJKJNaxHT.jpg,/3mFM80dPzSqoXXuC2UMvLIRWX32.jpg,The Twilight Saga: Eclipse,The Twilight Saga: Eclipse,False,,124
432,50014,"Aibileen Clark is a middle-aged African-American maid who has spent her life raising white children and has recently lost her only son; Minny Jackson is an African-American maid who has often offended her employers despite her family's struggles with money and her desperate need for jobs; and Eugenia ""Skeeter"" Phelan is a young white woman who has recently moved back home after graduating college to find out her childhood maid has mysteriously disappeared. These three stories intertwine to explain how life in Jackson, Mississippi revolves around ""the help""; yet they are always kept at a certain distance because of racial lines.",/wyvUmyzqGOBDyqLHRSukGDjI7bH.jpg,/7XLSwxpfpPoJyTdJVot6a42TS2V.jpg,The Help,The Help,False,,146
433,453354,"Ava, 13, is spending the summer on the Atlantic coast when she learns that she will lose her sight sooner than expected. Her mother decides to act as if everything were normal so as to spend their best summer ever. Ava confronts the problem in her own way. She steals a big black dog that belongs to a young man on the run...",/daOd8KBGDdsOhVdzXB3KU5fgBd2.jpg,/cUI1PFsrQVJR3IZOpkfsOOOUhTO.jpg,Ava,Ava,False,,106
434,106646,"A New York stockbroker refuses to cooperate in a large securities fraud case involving corruption on Wall Street, corporate banking world and mob infiltration. Based on Jordan Belfort's autobiography.",/blbA7NEHARQOWy5i9VF5K2kHrPc.jpg,/pWHf4khOloNVfCxscsXFj3jj6gP.jpg,The Wolf of Wall Street,The Wolf of Wall Street,False,,180
435,8587,"A young lion prince is cast out of his pride by his cruel uncle, who claims he killed his father. While the uncle rules with an iron paw, the prince grows up beyond the Savannah, living by a philosophy: No worries for the rest of your days. But when his past comes to haunt him, the young prince must decide his fate: Will he remain an outcast or face his demons and become what he needs to be?",/wXsQvli6tWqja51pYxXNG1LFIGV.jpg,/sKCr78MXSLixwmZ8DyJLrpMsd15.jpg,The Lion King,The Lion King,False,,89
436,324786,"WWII American Army Medic Desmond T. Doss, who served during the Battle of Okinawa, refuses to kill people and becomes the first Conscientious Objector in American history to receive the Congressional Medal of Honor.",/rshlQ6LfPRSWFhpGL4s5ZkIPR51.jpg,/fTuxNlgEm04PPFkr1xfK94Jn8BW.jpg,Hacksaw Ridge,Hacksaw Ridge,False,,139
437,112355,"A wealthy author's second wife begins to suspect that her 12-year old stepson may have murdered his mother, who mysteriously died in a bathtub accident.",/eKYX2Mz8XYzdwAKSEaIH22RO6nt.jpg,/nlPRui4dWzg33YehRrUojxFJUFk.jpg,Diabólica malicia,What the Peeper Saw,False,,89
438,381284,"The untold story of Katherine G. Johnson, Dorothy Vaughan and Mary Jackson – brilliant African-American women working at NASA and serving as the brains behind one of the greatest operations in history – the launch of astronaut John Glenn into orbit. The visionary trio crossed all gender and race lines to inspire generations to dream big.",/rfkIeCaIHhN3K5wjJJqKmfUjYp8.jpg,/9lfz2W2uGjyow3am00rsPJ8iOyq.jpg,Hidden Figures,Hidden Figures,False,,127
439,744,"For Lieutenant Pete 'Maverick' Mitchell and his friend and co-pilot Nick 'Goose' Bradshaw, being accepted into an elite training school for fighter pilots is a dream come true. But a tragedy, as well as personal demons, will threaten Pete's dreams of becoming an ace pilot.",/am0wHjplG1YynuDWz2LPWx5V9kJ.jpg,/56XAyRDe8UpeAb7QKdqyERpXhTM.jpg,Top Gun,Top Gun,False,,110
440,673,"Year three at Hogwarts means new fun and challenges as Harry learns the delicate art of approaching a Hippogriff, transforming shape-shifting Boggarts into hilarity and even turning back time. But the term also brings danger: soul-sucking Dementors hover over the school, an ally of the accursed He-Who-Cannot-Be-Named lurks within the castle walls, and fearsome wizard Sirius Black escapes Azkaban. And Harry will confront them all.",/vbk5CfaAHOjQPSAcYm6AoRRz2Af.jpg,/aWxwnYoe8p2d2fcxOqtvAtJ72Rw.jpg,Harry Potter and the Prisoner of Azkaban,Harry Potter and the Prisoner of Azkaban,False,,141
441,75258,Tinkerbell wanders into the forbidden Winter woods and meets Periwinkle. Together they learn the secret of their wings and try to unite the warm fairies and the winter fairies to help Pixie Hollow.,/wBfvAZ9y5D2HjtHKiLiwsTxP8iu.jpg,/bnbzEKX9LgDuJ0VBGm5d60mKDaR.jpg,Secret of the Wings,Secret of the Wings,False,,92
442,14836,"When Coraline moves to an old house, she feels bored and neglected by her parents. She finds a hidden door with a bricked up passage. During the night, she crosses the passage and finds a parallel world where everybody has buttons instead of eyes, with caring parents and all her dreams coming true. When the Other Mother invites Coraline to stay in her world forever, the girl refuses and finds that the alternate reality where she is trapped is only a trick to lure her.",/hofnlIyF6bePkgQOpcuRWLvzf15.jpg,/gPMh5rsVrDDAYMDbTcz6Up1DQ4z.jpg,Coraline,Coraline,False,,100
443,259316,"In 1926, Newt Scamander arrives at the Magical Congress of the United States of America with a magically expanded briefcase, which houses a number of dangerous creatures and their habitats. When the creatures escape from the briefcase, it sends the American wizarding authorities after Newt, and threatens to strain even further the state of magical and non-magical relations.",/8Qsr8pvDL3s1jNZQ4HK1d1Xlvnh.jpg,/h6NYfVUyM6CDURtZSnBpz647Ldd.jpg,Fantastic Beasts and Where to Find Them,Fantastic Beasts and Where to Find Them,False,,132
444,20982,"Demons that once almost destroyed the world, are revived by someone. To prevent the world from being destroyed, the demon has to be sealed and the only one who can do it is the shrine maiden Shion from the country of demons, who has two powers; one is sealing demons and the other is predicting the deaths of humans. This time Naruto's mission is to guard Shion, but she predicts Naruto's death. The only way to escape it, is to get away from Shion, which would leave her unguarded, then the demon, whose only goal is to kill Shion will do so, thus meaning the end of the world. Naruto decides to challenge this ""prediction of death.""",/mUC2BS04DlszdqJQ9vz9MFuPiDd.jpg,/vDkct38sSFSWJIATlfJw0l3QOIR.jpg,劇場版 NARUTO -ナルト- 疾風伝,Naruto Shippuden the Movie,False,,94
445,284053,"Thor is imprisoned on the other side of the universe and finds himself in a race against time to get back to Asgard to stop Ragnarok, the destruction of his home-world and the end of Asgardian civilization, at the hands of a powerful new threat, the ruthless Hela.",/6G2fLCVm9fiLyHvBrccq6GSe2ih.jpg,/rzRwTcFvttcN1ZpX2xv4j3tSdJu.jpg,Thor: Ragnarok,Thor: Ragnarok,False,,131
446,18095,"Son Goku Jr. is the great-great-great-great-grandson of the legendary martial artist Son Goku. However, unlike his predecessor he's not a brave fighter. He's constantly picked on by school bullies, his grandmother Pan sees this and she's worried, but even though Goku Jr. is not a strong and powerful Saiyan, he has a kind heart, and Pan loves him. When Pan gets sick Goku Jr. realizes he must do something if he doesn't want to lose Pan. Then he will remember about the legends of the Dragon Balls. It was told they granted a wish to the bearer, Goku Jr. needs a magical wish more than ever.",/sLCN5b2WYsYkWMrMMCnRHGv1VEO.jpg,/vjqcrp7nQGUVkVWeJR3HUAj0AyR.jpg,ドラゴンボールGT 悟空外伝! 勇気の証しは四星球(スーシンチュウ),Dragon Ball GT: A Hero's Legacy,False,,45
447,1930,"Peter Parker is an outcast high schooler abandoned by his parents as a boy, leaving him to be raised by his Uncle Ben and Aunt May. Like most teenagers, Peter is trying to figure out who he is and how he got to be the person he is today. As Peter discovers a mysterious briefcase that belonged to his father, he begins a quest to understand his parents' disappearance – leading him directly to Oscorp and the lab of Dr. Curt Connors, his father's former partner. As Spider-Man is set on a collision course with Connors' alter ego, The Lizard, Peter will make life-altering choices to use his powers and shape his destiny to become a hero.",/sLWUtbrpiLp23a0XDSiUiltdFPJ.jpg,/fSbqPbqXa7ePo8bcnZYN9AHv6zA.jpg,The Amazing Spider-Man,The Amazing Spider-Man,False,,136
448,10195,"Against his father Odin's will, The Mighty Thor - a powerful but arrogant warrior god - recklessly reignites an ancient war. Thor is cast down to Earth and forced to live among humans as punishment. Once here, Thor learns what it takes to be a true hero when the most dangerous villain of his world sends the darkest forces of Asgard to invade Earth.",/3SDoquTjagne0jWzdxEu31KFLmw.jpg,/prSfAi1xGrhLQNxVSUFh61xQ4Qy.jpg,Thor,Thor,False,,115
449,118,"A young boy wins a tour through the most magnificent chocolate factory in the world, led by the world's most unusual candy maker.",/bSvUW4JQ6g4QiKvwejcfcPRd4Ke.jpg,/wfGfxtBkhBzQfOZw4S8IQZgrH0a.jpg,Charlie and the Chocolate Factory,Charlie and the Chocolate Factory,False,,115
450,166426,"Thrust into an all-new adventure, a down-on-his-luck Capt. Jack Sparrow feels the winds of ill-fortune blowing even more strongly when deadly ghost sailors led by his old nemesis, the evil Capt. Salazar, escape from the Devil's Triangle. Jack's only hope of survival lies in seeking out the legendary Trident of Poseidon, but to find it, he must forge an uneasy alliance with a brilliant and beautiful astronomer and a headstrong young man in the British navy.",/7C921eWK06n12c1miRXnYoEu5Yv.jpg,/qwoGfcg6YUS55nUweKGujHE54Wy.jpg,Pirates of the Caribbean: Dead Men Tell No Tales,Pirates of the Caribbean: Dead Men Tell No Tales,False,,129
451,354912,"Despite his family’s baffling generations-old ban on music, Miguel dreams of becoming an accomplished musician like his idol, Ernesto de la Cruz. Desperate to prove his talent, Miguel finds himself in the stunning and colorful Land of the Dead following a mysterious chain of events. Along the way, he meets charming trickster Hector, and together, they set off on an extraordinary journey to unlock the real story behind Miguel's family history.",/askg3SMvhqEl4OL52YuvdtY40Yb.jpg,/gGEsBPAijhVUFoiNpgZXqRVWJt2.jpg,Coco,Coco,False,,105
452,672,"Cars fly, trees fight back, and a mysterious house-elf comes to warn Harry Potter at the start of his second year at Hogwarts. Adventure and danger await when bloody writing on a wall announces: The Chamber Of Secrets Has Been Opened. To save Hogwarts will require all of Harry, Ron and Hermione’s magical abilities and courage.",/1stUIsjawROZxjiCMtqqXqgfZWC.jpg,/sdEOH0992YZ0QSxgXNIGLq1ToUi.jpg,Harry Potter and the Chamber of Secrets,Harry Potter and the Chamber of Secrets,False,,161
453,671,"Harry Potter has lived under the stairs at his aunt and uncle's house his whole life. But on his 11th birthday, he learns he's a powerful wizard—with a place waiting for him at the Hogwarts School of Witchcraft and Wizardry. As he learns to harness his newfound powers with the help of the school's kindly headmaster, Harry uncovers the truth about his parents' deaths—and about the villain who's to blame.",/5jkE2SzR5uR2egEb1rRhF22JyWN.jpg,/wuMc08IPKEatf9rnMNXvIDxqP4W.jpg,Harry Potter and the Philosopher's Stone,Harry Potter and the Philosopher's Stone,False,,152
454,22,"Jack Sparrow, a freewheeling 18th-century pirate, quarrels with a rival pirate bent on pillaging Port Royal. When the governor's daughter is kidnapped, Sparrow decides to help the girl's love save her.",/jOh79POQu4hyVIseUxdQxTW7vOf.jpg,/z8onk7LV9Mmw6zKz4hT6pzzvmvl.jpg,Pirates of the Caribbean: The Curse of the Black Pearl,Pirates of the Caribbean: The Curse of the Black Pearl,False,,143
455,285,"Captain Barbossa, long believed to be dead, has come back to life and is headed to the edge of the Earth with Will Turner and Elizabeth Swann. But nothing is quite as it seems.",/3Au8rkDVsRK2AT4jq9dg6jH6buy.jpg,/2YMnBRh8F6fDGCCEIPk9Hb0cEyB.jpg,Pirates of the Caribbean: At World's End,Pirates of the Caribbean: At World's End,False,,169
456,58,Captain Jack Sparrow works his way out of a blood debt with the ghostly Davy Jones to avoid eternal damnation.,/8zfRLCgKrLAc5SSnACz8ZqmeKAP.jpg,/uXEqmloGyP7UXAiphJUu2v2pcuE.jpg,Pirates of the Caribbean: Dead Man's Chest,Pirates of the Caribbean: Dead Man's Chest,False,,151
457,1865,"Captain Jack Sparrow crosses paths with a woman from his past, and he's not sure if it's love -- or if she's a ruthless con artist who's using him to find the fabled Fountain of Youth. When she forces him aboard the Queen Anne's Revenge, the ship of the formidable pirate Blackbeard, Jack finds himself on an unexpected adventure in which he doesn't know who to fear more: Blackbeard or the woman from his past.",/uzIGtyS6bbnJzGsPL93WCF1FWm8.jpg,/keGfSvCmYj7CvdRx36OdVrAEibE.jpg,Pirates of the Caribbean: On Stranger Tides,Pirates of the Caribbean: On Stranger Tides,False,,137
458,19995,"In the 22nd century, a paraplegic Marine is dispatched to the moon Pandora on a unique mission, but becomes torn between following orders and protecting an alien civilization.",/jlQJDD0L5ZojjlS0KYnApdO0n19.jpg,/jRXYjXNq0Cs2TcJjLkki24MLp7u.jpg,Avatar,Avatar,False,,162
459,284052,"After his career is destroyed, a brilliant but arrogant surgeon gets a new lease on life when a sorcerer takes him under her wing and trains him to defend the world against evil.",/eQN31P4IEhyp6NkdccvppJnyuJ4.jpg,/uGBVj3bEbCoZbDjjl9wTxcygko1.jpg,Doctor Strange,Doctor Strange,False,,115
460,24593,"For a book project, photographer Timothy Greenfield-Sanders took photographs of 30 stars of adult movies, each pair of photographs in the same pose, clothed and nude. This film records the photo shoots and includes interviews with the performers and commentary from eight writers (and John Waters). The actors and writers discuss economics, nudity and exhibitionism, careers, and private lives.",/1Gf5YdhlJ1G7Tf7WkSRrs6ssZ3G.jpg,/kqB0fF7VlODmw1exH4iDZHGUiVI.jpg,Thinking XXX,Thinking XXX,False,,58
461,440249,"After Porn Ends 2 picks up where its predecessor left off and not only turns back the clock to meet the oldest living stars in adult film's history, but goes in depth with some of Its most current retirees and juxtaposes their experiences in a life after porn. Delving deeper into society's ongoing stigmas of race, misogyny, and the reality of decreasing opportunities for these former VHS box cover stars. For some, their careers in adult entertainment is accepted proudly and without regret. In fact, it seems to have proven to be the pathway to their current happiness and inner peace. For others, however, a career in porn has proven to be a conduit to certain despair as they struggle to find a way to bury their past and emerge with a new career or calling.",/uO6ZUez70Twan92pqoV60T9kiGH.jpg,/rfItXrtDGILwsCdmgVxX79phFuI.jpg,After Porn Ends 2,After Porn Ends 2,False,,90
462,503210,"A multi-part documentary about the making of the Jurassic Park trilogy. Each part walks through the making of part of one of the films, including the hurricane during the shooting of the first film, and how advances in CGI for Jurassic Park helped change the world of special effects forever. All interviews for these retrospective documentaries come with comments from Spielberg, Johnston, Neill, Dern, Goldblum, the effects crews, the child actors, and Peter Stormare. This documentary is broken into five parts: Dawn of a New Era (25 min) Making Prehistory (20 min), the Next Step in Evolution (15 min), and the Third Adventure (25 min), Finding the Lost World (28 min), and Something Survived (16 min).",/ozIhpAb69vQahq5obDlRGP87Y0m.jpg,/mPyu59cDdmMDDW9IOtfjVlM0THd.jpg,Return to Jurassic Park,Return to Jurassic Park,False,,129
463,381749,"Italy, 1970. An increasing legion of harmless warriors begins a peaceful struggle for sexual freedom through pornography, shaking and shocking religious authorities and conservative political institutions. They are ironic, happy, crazy. They are dreamers, defenders of definitive communion between body and soul. But they were censored and humiliated. They were mistreated and arrested for demanding loud a new cultural renaissance.",/slh9qCbyDcMN2rC9FiueZ6pR2fj.jpg,/xhB2hGJBSvK69ZDOZJvNnoGh9vL.jpg,Porno & Libertà,Porn to Be Free,False,,79
464,710832,"The story of the real Peaky Blinders and how they became a TV sensation. Hear of the actual gangsters who became leading characters in the series and the real events behind many of the main story lines, learn the identity of the crime family that inspired the Shelbys, then take a tour of the film locations where the dark and violent world of the Peaky Blinders was recreated.",,,Peaky Blinders: The True Story,Peaky Blinders: The True Story,False,,50
465,435365,"The Skywalker family is at the heart of the Star Wars saga. Now hear the inside story of Luke and Anakin Skywalker from the characters who witnessed it all: the famous droid duo C-3PO and R2-D2. Episodes IV,V and VI are explored in ""The Story of Luke Skywalker,"" which follows the young man escaping from his daily chores on Tatooine to his becoming a hero in the Rebal Alliance. In ""The Story of Anakin Skywalker,"" you'll go behind the mask of the greatest Star Wars villain and discover how Darth Vader started life as a young Podracing Champ on Tatooine and later became a headstrong young Jedi seduced by the Dark Side of the Force. With clips from the Star Wars films, C-3PO and R2-D2 take you on an hour-long journey through the saga and prepare you for the explosive final chapter: Star Wars: Episode III Revenge of the Sith.",,/fvw9W7ds0Q51hQIbS7JoUBqL3tK.jpg,The Story of Star Wars,The Story of Star Wars,False,,60
466,109520,"Documentary examining what happens to some of the biggest names in the history of the adult entertainment industry after they leave the business and try and live ""normal"" lives.",/iSkjNyhsIXGkwD0oSYcI83MRTz9.jpg,/aPerSjt4viv7Ik8OEHL83AbrH6R.jpg,After Porn Ends,After Porn Ends,False,,90
467,447399,"While Senator Kelly addresses a senate committee about the supposed mutant menace, we learn about the making of the movie, X-Men.",/chn9jBtOC65JlOd4IObtNjwX3UK.jpg,/4FwbuT0NJwcHGRqRc3kpTjgj0jS.jpg,X-Men: The Mutant Watch,X-Men: The Mutant Watch,False,,22
468,196733,A documentary exploring the historical concept of the narrative of Stanley Kubrick's 1964 film Dr. Strangelove Or: How I Learned to Stop Worrying and Love The Bomb. This short documentary compares the film with the actual events concerning the Cold War and the Cuban Missle Crisis.,,/wO3DpTA8MHWiMTd6wEucjDyg4QW.jpg,No Fighting in the War Room Or: Dr Strangelove and the Nuclear Threat,No Fighting in the War Room Or: Dr Strangelove and the Nuclear Threat,False,,30
469,318256,A first-ever look at the realities of the professional “amateur” porn world and the steady stream of 18-to-19-year old girls entering into it.,/bV7eAcBrYb57PwjpQ2ODT6VyFPd.jpg,/75ot83QOkc02vujyzmIbumQCU6Y.jpg,Hot Girls Wanted,Hot Girls Wanted,False,,84
470,324558,"The evolution of adult cinema through the most influential films in history, a journey that begins in the 1970s and ends nowadays. An in-depth analysis of the success of the most prestigious erotic films, their impact on industry and society, and their influence on cinema and contemporary culture.",/5cnbmWWnzC2L0CbOYZDeCWbHHJP.jpg,/uYzHkzZPp84B7nHOKaJZWjyGFUL.jpg,X-Rated: The Greatest Adult Movies of All Time,X-Rated: The Greatest Adult Movies of All Time,False,,94
471,16290,"Johnny Knoxville, Bam Margera, Steve-O, Wee Man and the rest of their fearless and foolhardy friends take part in another round of outrageous pranks and stunts. In addition to standing in the path of a charging bull, launching themselves into the air and crashing through various objects, the guys perform in segments such as ""Sweatsuit Cocktail,"" ""Beehive Tetherball"" and ""Lamborghini Tooth Pull.""",/ta1KuiThmEqVkW2kvOeOHmKIpmn.jpg,/ueLwOGA5hsOzuoY25oZfFLMHZLS.jpg,Jackass 3D,Jackass 3D,False,,99
472,483898,"To mark the release two weeks ago of the eighth and final movie in the series, Robbie Coltrane narrates a countdown of the movie franchise's best moments. From Harry's first meeting with Ron and Hermione aboard the Hogwarts Express through to magical mysteries.",/4LOxoeZWt5wr9mooxEZRFK96lDd.jpg,/g1xiBoLD6v3ZaXPa4QtuXiQeYKW.jpg,50 Greatest Harry Potter Moments,50 Greatest Harry Potter Moments,False,,93
473,283317,"His teachers, coaches, childhood friends and Barça teammates, together with journalists, writers and prominent figures from the history of football, come together in a restaurant to analyze and pick apart Messi's personality both on and off the field, and to look back at some of the most significant moments in his life. Viewed from Álex de la Iglesia's unique perspective, Messi recreates the player's childhood and teenage years, from his very first steps, with a football always at his feet, through to the decision to leave Rosario for Barcelona, the separation from his family, and the role played in his career by individuals such as Ronaldinho, Rijkaard, Rexach and Guardiola.",/7zYSwSy1rHROtd7Lmmf8A0ZC2dK.jpg,/uROT3bgu8I50EyDA541aozJjYl3.jpg,Messi,Messi,False,,93
474,61927,"Journalist Fabian Burstein looks behind the curtains of the porn industry. Starting in Budapest he heads westwards to explore a new world on its victory march rooted deeply in Austria. On this journey he meets the heroes and leading actors of this story: Austrians Mick Blue, Renee Pornero and Thomas Janisch. Porno Unplugged follows its native porn stars to where their lives happen. From east to west...",/dZ1sOBUIrgX4iIEKjo6GiQpUMiL.jpg,/uoQmK7FRXNIQa7sikGg1xM0QaN9.jpg,Porno Unplugged,Porno Unplugged,False,,105
475,150354,"This documentary treats film fans to a behind-the-scenes look at the making of Jurassic Park, one of the 90's biggest hits and a milestone in special effects development. Narrated by James Earl Jones, it includes footage of the filming process, as well as interviews with director Steven Spielberg, and other members of the cast and crew, who give their insights into what it was like working together on this project and the efforts it took to bring the film to completion.",,/wvTP6LsRbn09q5SjiK8gWqiHXmm.jpg,The Making of 'Jurassic Park',The Making of 'Jurassic Park',False,,51
